{
  "schemaVersion": 1,
  "catalogId": "2026-10",
  "timezone": "America/New_York",
  "coverage": {
    "start": "2026-10-10",
    "end": "2026-10-31"
  },
  "provenance": {
    "producer": "migration",
    "notes": "Existing published records imported without fresh research. Verification timestamps and original discovery provenance retained. Work has not published this catalog. Unverified parser-inferred all-day event quarantined; original record remains in content/discovery snapshot."
  },
  "events": [
    {
      "id": "great-pumpkin-fest-2026",
      "name": "Великий гарбузовий фестиваль",
      "category": "festival",
      "icon": "🎃",
      "venue": "Cherokee Veterans Park",
      "address": "7345 Cumming Hwy, Canton, GA 30115",
      "distanceLabel": "≈ 10 миль",
      "familyPrice": 0,
      "priceNote": "Вхід безкоштовний. Їжа та покупки оплачуються окремо.",
      "description": "Осінній день із конкурсом костюмів, творчими заняттями, тваринами та розвагами просто неба.",
      "comfortNote": "Відкритий майданчик; уточніть доступність і умови для візочків у організатора.",
      "source": "https://www.bsheepevents.com/events/the-great-pumpkin-fest-1",
      "sessions": [
        {
          "start": "2026-10-10T10:00",
          "end": "2026-10-10T15:00"
        }
      ],
      "points": {
        "children": 28,
        "comfort": 15,
        "distance": 12,
        "uniqueness": 9
      },
      "verifiedAt": "2026-10-09T12:00:00Z",
      "verification": "Official page evidence matched; no cancellation notice detected on configured pages.",
      "city": "Canton",
      "mapsUrl": "https://www.google.com/maps/search/?api=1&query=7345%20Cumming%20Hwy%2C%20Canton%2C%20GA%2030115",
      "admissionPrice": null,
      "additionalCosts": "Вхід безкоштовний. Їжа та покупки оплачуються окремо.",
      "uncertaintyNotes": [
        "Вартість входу на одну особу не подана окремо; дивіться примітку про ціну та офіційне джерело.",
        "Вимоги реєстрації не підтверджено."
      ],
      "origin": "legacy-editorial",
      "registration": null
    },
    {
      "id": "cagles-fall-2026",
      "name": "Осінні вихідні на Cagle’s Farm",
      "category": "farm",
      "icon": "🌽",
      "venue": "Cagle’s Farm · Holly Springs",
      "address": "362 Stringer Road, Holly Springs, GA 30115",
      "distanceLabel": "≈ 10 миль",
      "familyPrice": 60,
      "priceNote": "$15 за людину віком від 3 років: $60 за 2 дорослих + 2 дітей (3+). Гарбузи окремо; поїздка до озера з багаттям — ще $5 за людину.",
      "description": "Кукурудзяний лабіринт, мінілабіринт, фермерські тварини, перегони поросят і дворові ігри. Дати відповідають вихідним, зазначеним у програмі ферми; час — офіційному розкладу роботи.",
      "comfortNote": "Діти до 14 років включно мають бути з дорослим. Відкритий майданчик; домашніх тварин не допускають, службові тварини дозволені.",
      "source": "https://caglesfarm.com/",
      "sessions": [
        {
          "start": "2026-10-10T10:00",
          "end": "2026-10-10T22:00"
        },
        {
          "start": "2026-10-11T10:00",
          "end": "2026-10-11T18:00"
        },
        {
          "start": "2026-10-16T17:00",
          "end": "2026-10-16T22:00"
        },
        {
          "start": "2026-10-17T10:00",
          "end": "2026-10-17T22:00"
        },
        {
          "start": "2026-10-18T10:00",
          "end": "2026-10-18T18:00"
        },
        {
          "start": "2026-10-23T17:00",
          "end": "2026-10-23T22:00"
        },
        {
          "start": "2026-10-24T10:00",
          "end": "2026-10-24T22:00"
        },
        {
          "start": "2026-10-25T10:00",
          "end": "2026-10-25T18:00"
        },
        {
          "start": "2026-10-30T17:00",
          "end": "2026-10-30T22:00"
        },
        {
          "start": "2026-10-31T10:00",
          "end": "2026-10-31T22:00"
        }
      ],
      "points": {
        "children": 29,
        "comfort": 14,
        "distance": 12,
        "uniqueness": 8
      },
      "farm": {
        "name": "Cagle’s Farm",
        "source": "https://caglesfarm.com/"
      },
      "verifiedAt": "2026-10-09T12:00:00Z",
      "verification": "Official page evidence matched; no cancellation notice detected on configured pages.",
      "city": "Holly Springs",
      "mapsUrl": "https://www.google.com/maps/search/?api=1&query=362%20Stringer%20Road%2C%20Holly%20Springs%2C%20GA%2030115",
      "admissionPrice": null,
      "additionalCosts": "$15 за людину віком від 3 років: $60 за 2 дорослих + 2 дітей (3+). Гарбузи окремо; поїздка до озера з багаттям — ще $5 за людину.",
      "uncertaintyNotes": [
        "Вартість входу на одну особу не подана окремо; дивіться примітку про ціну та офіційне джерело.",
        "Вимоги реєстрації не підтверджено."
      ],
      "origin": "legacy-editorial",
      "registration": null
    }
  ],
  "submittedAt": "2026-10-10T09:00:00Z",
  "issues": []
}
